{
  "$schema": "https://json-schema.org/draft/2020-12/schema",
  "$id": "urn:jimu:session-event-read:0.1.0:task-binding-v1",
  "type": "object",
  "additionalProperties": false,
  "properties": {
    "version": {
      "const": 1
    },
    "profile": {
      "const": "local-session-event-read-v1"
    },
    "historyVersion": {
      "const": 1
    },
    "contentPolicy": {
      "const": "public-v1"
    },
    "allowedSessions": {
      "const": "current-task"
    },
    "boundary": {
      "const": "pre-step"
    },
    "capabilities": {
      "const": [
        "session_event_read"
      ]
    },
    "maxInputBytes": {
      "const": 1024
    },
    "maxJsonDepth": {
      "const": 4
    },
    "maxWindowSide": {
      "const": 4
    },
    "maxNeighbors": {
      "const": 8
    },
    "maxEventBytes": {
      "const": 16384
    },
    "maxEvents": {
      "const": 128
    },
    "maxSummaryCodePoints": {
      "const": 256
    },
    "maxSummaryTextBytes": {
      "const": 1024
    },
    "maxSummaryJsonBytes": {
      "const": 1536
    },
    "maxOutputBytes": {
      "const": 32768
    },
    "maxReadRows": {
      "const": 9
    },
    "maxReadScratchBytes": {
      "const": 1048576
    },
    "maxContextBytes": {
      "const": 4096
    },
    "maxRecent": {
      "const": 8
    },
    "timeoutMs": {
      "const": 2000
    },
    "lockWaitSeconds": {
      "const": 1
    },
    "maxModelRequestBytes": {
      "const": 65536
    },
    "maxCheckpointBytes": {
      "const": 131072
    },
    "maxModelResponseBytes": {
      "const": 16384
    },
    "maxCallsPerResponse": {
      "const": 4
    },
    "maxModelRequests": {
      "const": 8
    },
    "maxToolInvocations": {
      "const": 20
    },
    "maxAttempts": {
      "const": 8
    },
    "maxReliableEvents": {
      "const": 256
    },
    "maxSummaryBytes": {
      "const": 8192
    },
    "maxDatabaseBodyBytes": {
      "const": 7340032
    },
    "maxMetadataBytes": {
      "const": 65536
    },
    "reservedTaskBytes": {
      "const": 8388608
    },
    "retentionSeconds": {
      "const": 604800
    },
    "catalogDigest": {
      "const": "82ac8d60427d7b60632c8d0072d2c6c4fff2858f9f8c342ca412080a703b24e0"
    }
  },
  "required": [
    "version",
    "profile",
    "historyVersion",
    "contentPolicy",
    "allowedSessions",
    "boundary",
    "capabilities",
    "maxInputBytes",
    "maxJsonDepth",
    "maxWindowSide",
    "maxNeighbors",
    "maxEventBytes",
    "maxEvents",
    "maxSummaryCodePoints",
    "maxSummaryTextBytes",
    "maxSummaryJsonBytes",
    "maxOutputBytes",
    "maxReadRows",
    "maxReadScratchBytes",
    "maxContextBytes",
    "maxRecent",
    "timeoutMs",
    "lockWaitSeconds",
    "maxModelRequestBytes",
    "maxCheckpointBytes",
    "maxModelResponseBytes",
    "maxCallsPerResponse",
    "maxModelRequests",
    "maxToolInvocations",
    "maxAttempts",
    "maxReliableEvents",
    "maxSummaryBytes",
    "maxDatabaseBodyBytes",
    "maxMetadataBytes",
    "reservedTaskBytes",
    "retentionSeconds",
    "catalogDigest"
  ]
}
