{
  "version": 1,
  "profile": "local-session-event-read-v1",
  "historyVersion": 1,
  "contentPolicy": "public-v1",
  "allowedSessions": "current-task",
  "boundary": "pre-step",
  "capabilities": [
    "session_event_read"
  ],
  "maxInputBytes": 1024,
  "maxJsonDepth": 4,
  "maxWindowSide": 4,
  "maxNeighbors": 8,
  "maxEventBytes": 16384,
  "maxEvents": 128,
  "maxSummaryCodePoints": 256,
  "maxSummaryTextBytes": 1024,
  "maxSummaryJsonBytes": 1536,
  "maxOutputBytes": 32768,
  "maxReadRows": 9,
  "maxReadScratchBytes": 1048576,
  "maxContextBytes": 4096,
  "maxRecent": 8,
  "timeoutMs": 2000,
  "lockWaitSeconds": 1,
  "maxModelRequestBytes": 65536,
  "maxCheckpointBytes": 131072,
  "maxModelResponseBytes": 16384,
  "maxCallsPerResponse": 4,
  "maxModelRequests": 8,
  "maxToolInvocations": 20,
  "maxAttempts": 8,
  "maxReliableEvents": 256,
  "maxSummaryBytes": 8192,
  "maxDatabaseBodyBytes": 7340032,
  "maxMetadataBytes": 65536,
  "reservedTaskBytes": 8388608,
  "retentionSeconds": 604800,
  "catalogDigest": "82ac8d60427d7b60632c8d0072d2c6c4fff2858f9f8c342ca412080a703b24e0"
}
